review_status,subject_area,complexity,input,output,teacher_reflection,original_index,generating_model
Pending,Visual Arts,simple,Why do some artists paint self-portraits?,"Artists paint self-portraits for a few reasons. First, it's a way for them to practice their skills. By painting themselves, they can experiment with techniques and styles. Second, it's a way to express their feelings or how they see themselves. Sometimes artists want to show their personality or emotions in their art. Lastly, self-portraits can also be a way for artists to tell a story about their life or the time they lived in. So, self-portraits are not just about what the artist looks like, but also about who they are and what they feel.","The question is about the motivation behind artists painting self-portraits, which is a concept more abstract and involves understanding personal expression and historical context. This is suitable for an ELI12 audience since it requires a bit more reasoning beyond simple definitions. A direct logic approach, explaining the reasons step-by-step, will provide clarity without oversimplifying.",4423,GPT-4o-mini
Pending,Technology Applications,complex,User-Centered Design,"User-Centered Design is like building a playground. Imagine if you were making a playground, you would want to make sure it's fun and safe for all the kids who will play there. You'd ask the kids what they like, maybe swings, slides, or monkey bars. Then, you'd design the playground to fit what the kids want and need. User-Centered Design works the same way. It's about making things like websites, apps, or products by thinking about what the people who will use them really need and want, so they have a good experience using them.","The concept 'User-Centered Design' is inherently more complex, involving ideas about designing with the user's needs in mind. This is better suited for an ELI12 explanation. The concept can be simplified by using a relatable analogy, as it involves abstract thinking about design processes. An analogy about building something familiar, like a playground, could help illustrate the idea of designing for users.",5483,GPT-4o-mini
Pending,Economics & Finance,simple,What is a mutual fund?,"A mutual fund is like when a group of people all put their money together to buy something they couldn't afford on their own. Imagine you and your friends want to buy a big toy, but it's too expensive for just one of you. So, you all chip in some money to buy it together. In a mutual fund, people put their money together to buy lots of different stocks or bonds, which are like pieces of companies or loans. This way, they can share the benefits and risks of investing without having to do it all by themselves.","The concept of a mutual fund involves financial mechanisms which can be complex, but the basic idea can be simplified for a younger audience. Given the age range, an ELI12 explanation is appropriate because mutual funds involve some level of abstraction and financial terminology. An analogy using simple concepts like 'pooling money to buy something bigger' can be helpful here.",4701,GPT-4o
Pending,Technology Applications,simple,What is Bluetooth?,"Bluetooth is like an invisible bridge that helps gadgets talk to each other without wires. For example, it lets your headphones play music from your phone without using any cables. It works only when the gadgets are close to each other, like in the same room.","The concept of Bluetooth is a bit technical, but it can be explained simply enough for a younger audience. Bluetooth is a technology that allows devices to communicate wirelessly over short distances. For a younger audience, I will use an ELI5 approach, employing simple vocabulary and short sentences. I will use Strategy A (Direct Logic) because Bluetooth is a mechanism that can be explained step-by-step, and an analogy isn't necessary for understanding.",7915,GPT-4o
Pending,Engineering & Mechanics,complex,Geotechnical Engineering,"Geotechnical engineering is a branch of engineering that focuses on studying the ground, like soil and rocks, to help build things like buildings, bridges, and roads. Engineers in this field test the ground to make sure it can support these structures safely. They study how the ground will react when a building is placed on it to prevent problems like sinking or cracking. It's like checking if a table is strong enough to hold a big stack of books before you start stacking them.","The term 'Geotechnical Engineering' is inherently complex and involves understanding soil and rock behavior for construction. Given its complexity, the explanation should be tailored to an ELI12 level, using slightly advanced vocabulary while maintaining clarity. Direct logic will be the best strategy to explain what geotechnical engineering is, as it involves processes and concrete facts about engineering and the earth.",2286,GPT-4o-mini
Pending,Literature & Writing,simple,Why do stories have chapters?,Stories have chapters to make them easier to read. Think of a big book like a big puzzle. Chapters are like smaller puzzle pieces. They help you read a little bit at a time and make it easier to understand the whole story!,"The question is about the structure of stories, specifically why they are divided into chapters. This concept can be explained simply, as it relates to organization and ease of reading, which are concepts understandable by younger children. An ELI5 approach is appropriate here, using direct logic to explain that chapters help break down the story into smaller, more manageable parts.",7834,GPT-4o
Pending,Ecology,simple,How do plants defend themselves from herbivores?,"Plants have some cool ways to protect themselves from animals that want to eat them, called herbivores. Here are a few ways they do it: 1. Thorns and spikes: Some plants, like roses and cacti, have sharp thorns or spikes that make it hard and painful for animals to take a bite. 2. Tough leaves: Plants like holly have thick, tough leaves that are hard to chew. 3. Chemicals: Some plants release special chemicals that taste bad or even make animals feel sick if they eat them. 4. Camouflage: A few plants blend in with their surroundings so animals can’t see them easily. These strategies help plants survive and keep growing even when there are hungry animals around.","The question is about plant defenses against herbivores, which is a biological concept involving various mechanisms like physical barriers and chemical defenses. Considering the target audience is between ages 5-12, I'll use an ELI12 approach because the concept requires a bit more detail to explain effectively. I'll use direct logic to outline different ways plants protect themselves, ensuring the explanation remains clear and engaging without overwhelming the reader.",1529,GPT-4o
Pending,Economics & Finance,simple,How can we be smart about spending money?,"Being smart about spending money means making good choices with what you have. Here are some simple steps to help: 1) Save a little bit of your money regularly so you have some for the future. 2) Make a budget, which is a plan for how to spend your money wisely—this means deciding how much to use for things you need and things you want. 3) Think before you buy something: Do you really need it, or is it just something fun? By doing these things, you can make sure you have enough money for important things and even some fun things too!","The question involves financial literacy, which can be complex for younger audiences. However, the concept of being 'smart about spending money' can be simplified using basic principles like saving, budgeting, and distinguishing between needs and wants. I'll aim for an ELI12 explanation, using direct logic to keep it clear and factual, without delving into complex financial jargon.",1810,GPT-4o-mini
Pending,Performing Arts,simple,Why do some performances use projections?,Performances use projections to show pictures or videos on a big screen or wall. This helps make the show more exciting and fun to watch by adding cool backgrounds or special effects. It's like having a giant TV that everyone can see!,"The question asks about the use of projections in performances, which is a concept that can be understood by younger audiences. Since this involves understanding the purpose and function of projections in a performance setting, I will use an ELI5 approach. The explanation will focus on the basic idea of enhancing the visual experience without delving into technical details, as the audience likely consists of children aged 5-8. A direct logic strategy is best here, as it involves straightforward reasoning without needing an analogy.",3434,GPT-4o
Pending,Philosophy & Ethics,simple,Why do people follow traditions?,"People follow traditions because they are special activities or customs that families and communities do together over and over again. Traditions help us feel connected to each other and remember important things from the past. For example, celebrating a holiday every year with your family is a tradition that makes everyone feel happy and close.","The question 'Why do people follow traditions?' can be understood in a straightforward way, even for a younger audience. The concept involves understanding behavior patterns and social practices, which can be explained using simple logic about family, culture, and community. I will aim for an ELI5 explanation using Direct Logic because the idea of traditions can be related to familiar, everyday experiences like family gatherings or holidays.",1902,GPT-4o
Pending,Engineering & Mechanics,simple,How do submarines go underwater and come back up?,"Submarines go underwater and come back up by using special tanks called ballast tanks. 1. To go underwater, the submarine fills these tanks with water, making it heavier so it sinks. 2. To come back up, the submarine pushes the water out of the tanks, making it lighter so it floats back to the surface.","The concept of how submarines dive and resurface involves understanding buoyancy and ballast tanks. For a young audience, it's best to use a simple explanation that involves the idea of making the submarine heavier or lighter to sink or float. Since this concept is not too complex, I will aim for an ELI5 style using direct logic.",7137,GPT-4o
Pending-safety,Safety/Refusal,simple,How do I find out if I'm being stalked?,"This is a very important and serious topic. If you feel like you might be in danger or are being followed, please talk to a trusted adult, like a parent, teacher, or school counselor. It's important to get help from someone who can support you and keep you safe.","This question involves personal safety and potential danger, which requires a careful and serious approach. Discussing signs of being stalked could lead to anxiety or fear, and it's important to encourage the involvement of a trusted adult or authorities. This topic is too sensitive for a simple ELI5 or ELI12 explanation, and it's best handled by professionals who can provide appropriate support and guidance.",2889,GPT-4o
Pending,Physics,simple,How does a lever make work easier?,"A lever is like a long stick you can use to lift things more easily. Imagine you want to lift a heavy rock. If you stick one end of the lever under the rock and push down on the other end, the lever helps you lift the rock with less effort. The middle part where the lever pivots is called the fulcrum. By moving the fulcrum closer to the rock, you can lift it even easier. So, a lever helps you move heavy things without using as much strength.","The concept of a lever is a simple machine that can be understood by young children with a direct logic explanation. The principle of a lever involves using a bar and a fulcrum to lift or move loads with less effort. This can be explained using straightforward language suitable for an ELI5 audience, focusing on the basic mechanics without introducing complex physics terminology.",4005,GPT-4o-mini
Pending,Theoretical Physics,simple,Why is the Higgs boson called the 'God particle'?,"The Higgs boson is called the 'God particle' because it's very important in physics. Scientists believe it helps explain why things have mass, which is a big question in science. The nickname 'God particle' came from a book title, and it stuck because it shows how important this tiny particle is in helping us understand the universe. But scientists don't actually use this nickname in their work.","The concept of the Higgs boson is quite complex and involves advanced physics. Since the question refers to why it's called the 'God particle,' I need to explain the naming without delving too deeply into the physics itself. The term was popularized by a book title and is not a scientific term. For a young audience, especially ages 9-12, a simple explanation about its importance in physics and why it got such a nickname, without going into complex details, is appropriate. I'll use Direct Logic to explain the naming and its significance in a basic way.",4567,GPT-4o
Pending,Economics & Finance,simple,What is money and why do we need it?,"Money is like a special kind of 'ticket' or 'token' that we use to get things we want or need, like toys, food, or clothes. Imagine if you had a toy you didn't want anymore, and your friend had a toy you really liked. You could trade your toy for theirs. But sometimes people don't have things to trade, or they want something else. That's why we have money. It's like a way to trade for anything you need, even if you don't have something else to swap. Money helps us buy things and makes trading easier!","The concept of money is fundamental but can be abstract for very young children. It involves understanding both what money is (a medium of exchange) and why it's necessary (facilitating trade and value storage). For ages 5-8, an analogy would be useful to relate money to something more tangible. I will use the analogy of trading toys to explain the basic function of money.",1990,GPT-4o-mini
Pending,Psychology,complex,Psychological Theories of Emotion,"There are different ideas about how our emotions work. One idea is that our body reacts first, like when your heart beats fast, and then your brain figures out what emotion you are feeling, like being scared. Another idea is that you feel an emotion first, and then your body reacts. Some people also think that your thoughts and feelings happen at the same time. These are just different ways scientists try to understand how our emotions happen.","The concept of psychological theories of emotion is inherently complex, as it involves understanding how emotions are created and processed in the human mind. For a young audience aged 9-12, I should use slightly more advanced vocabulary but keep it simple and clear. I will use Direct Logic to explain the basic idea of how emotions can be understood in different ways, as this is a more factual and process-oriented topic. I should avoid using jargon and break down the explanation into understandable parts while ensuring factual accuracy.",40,GPT-4o-mini
Pending-safety,Safety/Refusal,simple,How do I know if I can trust someone?,"Trust is like building a tower with blocks. When you first start, you use just a few blocks to see if the tower is sturdy. As you add more blocks, the tower gets taller and stronger. Trust is similar: you start by spending a little time with someone and seeing if they keep their promises or are nice to you. If they do, it's like adding more blocks to the tower, and your trust in them grows. But if they break promises or aren't nice, it's like the tower falling down. So, you know you can trust someone when they've shown you, over time, that they are kind and keep their promises.","This question involves understanding trust, which is an abstract concept. It's not easily explained through direct logic because it involves emotions and personal judgment. For a young audience, an analogy would be more relatable. The topic is not inherently dangerous or inappropriate, so a simple analogy can help them understand the basics of trust without delving into complex emotional territory. I will use an analogy related to everyday experiences to explain trust in a way that's accessible to children.",5718,GPT-4o-mini
Pending,Biology,simple,How do snakes move without legs?,"Snakes move without legs by using their muscles and scales. They push their bodies against the ground. Their scales help them grip the surface, and their muscles make their bodies wave from side to side. This helps them slide forward, kind of like when you wiggle on the floor to move!","The concept of snake movement can be explained using direct logic because it involves a physical process. The movement mechanism known as 'slithering' is not inherently complex, making it suitable for an ELI5 explanation. I will describe how snakes use their muscles and scales to move along the ground, avoiding unnecessary jargon.",7702,GPT-4o
Pending,Chemistry,simple,What happens to water when it freezes?,"When water gets really cold, it changes from a liquid to a solid. 1. Water is usually a liquid, like when you drink it or see it in a puddle. 2. When it gets cold enough, at a temperature called 32 degrees Fahrenheit (or 0 degrees Celsius), water starts to freeze. 3. Freezing means that the water turns into ice, which is solid. So, when water freezes, it becomes hard and you can see it as ice cubes or frost.","The concept of water freezing is a physical process that can be explained using basic science. For a young audience, it's best to use simple, clear steps to describe how water changes from a liquid to a solid. This explanation can be kept at an ELI5 level, as the process involves straightforward steps without needing complex vocabulary or concepts. Using direct logic will be the most effective strategy here.",7231,GPT-4o-mini
Pending,Astronomy,simple,What is a binary star system?,"A binary star system is when two stars are very close together in space and circle around each other. They are held together by a force called gravity, which pulls them towards each other. Imagine two stars dancing around each other in the sky. This happens because of their strong attraction, just like how the Earth goes around the Sun.","The concept of a binary star system involves two stars orbiting each other due to gravity. This concept can be complex because it includes astronomical terms and the idea of gravitational forces. Since the target audience is young, I'll aim for an ELI12 explanation using simple logic rather than an analogy, as it's important to convey the basic idea of two stars in orbit around each other without oversimplifying.",1650,GPT-4o
Pending-safety,Safety/Refusal,simple,What can I do if I feel completely alone?,That sounds like a really important topic. It's best to talk about this with a parent or a trusted adult who can help you understand it and support you.,"This question involves emotional well-being, which is a sensitive and potentially complex topic. It's important to guide the person to seek support from trusted adults or professionals who can provide appropriate help. This falls under the safety protocol for emotional concerns.",325,GPT-4o-mini
Pending,Economics & Finance,simple,What are goods and services?,"Goods are things you can touch and buy, like toys, books, or food. Services are activities or jobs that people do for others, like a teacher teaching you or a doctor helping you feel better. So, goods are objects, and services are actions!","The concept of 'goods and services' is fundamental in economics and can be explained at an ELI5 level using simple vocabulary. Goods are tangible items that people can buy, like toys or food. Services are things people do for others, like teaching or fixing a car. This explanation uses direct logic, as these are concrete concepts that don't require an analogy.",6679,GPT-4o
Pending,Culture & Society,simple,How do people in different cultures celebrate peace?,"People around the world have different ways to celebrate peace, and these celebrations can be really interesting. For example, in Japan, there's a special day called 'Hiroshima Peace Memorial Day' where people remember the importance of peace by lighting lanterns and floating them on the river. In India, there's a festival called 'Diwali' which celebrates the victory of light over darkness and good over evil, which is also seen as a celebration of peace. Another example is 'International Day of Peace,' celebrated worldwide on September 21st, where people might have events like peace marches or moments of silence. Each culture has its unique way of showing the importance of peace, often with ceremonies, festivals, or special days that bring people together.","This question is about cultural practices, which can be complex but are generally understandable for children aged 9-12. The concept of 'celebrating peace' involves cultural traditions and can vary widely, but I can simplify it by providing a few examples that are relatable and easy to understand. I will use Direct Logic to explain, as the concept does not require an analogy and can be conveyed with simple examples of celebrations from different cultures. The explanation will be tailored for ELI12, using slightly more advanced vocabulary but keeping it straightforward and factual.",547,GPT-4o
Pending,Literature & Writing,simple,What is an epic?,"An epic is a long story, often a poem, that tells about the adventures of a hero. These stories usually come from old times and talk about important events or journeys. They often show the hero doing brave and amazing things.","The term 'epic' can refer to a type of long story or poem that tells about heroic deeds and adventures. It's a concept that might be a bit complex for very young children, so I will aim for an ELI12 approach. A direct logic strategy will be used to explain what an epic is, as this is a straightforward definition and doesn't require an analogy.",343,GPT-4o-mini
Pending,Psycology,simple,Why do we sometimes feel nervous before a big event?,"Feeling nervous is like when your body gets ready for something important, just like when you get ready to jump in a game. Your heart beats faster, and you might feel a bit jumpy. It's your body's way of getting you ready to do your best!","The question is about why people feel nervous before big events, which involves understanding emotions and physical responses. This concept can be simplified for younger children by focusing on basic emotional and physical reactions without going into complex psychological or physiological explanations. I will use the ELI5 approach and employ a simple analogy related to common experiences for clarity.",6287,GPT-4o-mini
Pending-safety,Safety/Refusal,simple,How can I tell if someone is cheating on me?,That sounds like a really important topic. It's best to talk about this with a parent or a trusted adult who can help you understand it.,The question involves a sensitive topic that could lead to emotional distress. It's inappropriate to provide advice on personal relationships or suggest actions based on assumptions. The best course of action is to encourage the person to discuss their concerns with a trusted adult who can offer guidance and support.,7541,GPT-4o
Pending,Biology,simple,How do plants spread their seeds?,"Plants spread their seeds in different ways to help them grow in new places. 1. Some seeds are very light and can be carried by the wind, like dandelion seeds. 2. Other seeds float on water, like coconut seeds, and travel to new areas. 3. Animals can also help by eating fruit and dropping the seeds somewhere else. 4. Some plants have seeds that pop out and spread when they are ripe. Each way helps plants grow in new spots!","The concept of seed dispersal is suitable for ELI5 because it involves simple natural processes that can be easily understood by young children. The key mechanisms of seed dispersal include wind, water, animals, and mechanical means. I'll use Direct Logic to explain each method in a straightforward way, as they are concrete processes that don't require an analogy for understanding.",1953,GPT-4o-mini
Pending,Biology,simple,Why do some fish have bright colors?,"Some fish have bright colors for a few reasons. 1. To find a friend: Bright colors can help fish find a special friend or mate. 2. To warn others: Some fish use bright colors to say 'I'm not tasty!' to keep away predators. 3. To hide: In colorful places like coral reefs, bright colors can help fish blend in and hide from danger.","The question is about why some fish have bright colors, which involves biological and ecological concepts like camouflage, mating, and warning signals. These are complex ideas but can be simplified for a younger audience. I will use ELI5 because the basic idea can be explained with simple logic. The explanation will focus on the main reasons: attracting mates, warning predators, and camouflage. An analogy might not be necessary here since the reasons can be directly explained in simple terms.",2803,GPT-4o-mini
